{
  "$schema": "https://json-schema.org/draft/2020-12/schema",
  "$id": "urn:ghost-alice:skill-catalog:schema",
  "title": "Ghost-ALICE OS Skill Catalog",
  "description": "Ghost-ALICE OS skill catalog schema. The SSOT is each skill directory's SKILL.md frontmatter. The catalog is generated by build_catalog.py and should not be edited by hand.",
  "type": "object",
  "required": ["version", "generated_at", "source_root", "install_roots", "skills"],
  "additionalProperties": false,
  "properties": {
    "version": {
      "type": "string",
      "description": "Catalog schema version in semver format. Increase the major version for breaking compatibility changes.",
      "pattern": "^\\d+\\.\\d+\\.\\d+$"
    },
    "generated_at": {
      "type": "string",
      "description": "ISO 8601 UTC timestamp for the build_catalog.py run.",
      "format": "date-time"
    },
    "source_root": {
      "type": "string",
      "description": "Skill directory scan root, relative to the repository root."
    },
    "install_roots": {
      "type": "array",
      "description": "Top-level skill roots discovered by build_catalog.py and synchronized with installer install targets.",
      "items": { "type": "string" }
    },
    "skills": {
      "type": "array",
      "description": "All discovered skill entries sorted alphabetically by name.",
      "items": { "$ref": "#/$defs/skill" }
    }
  },
  "$defs": {
    "skill": {
      "type": "object",
      "required": ["name", "path", "description"],
      "additionalProperties": false,
      "properties": {
        "name": {
          "type": "string",
          "description": "Skill identifier. Must match the SKILL.md frontmatter name and directory name.",
          "pattern": "^[a-z0-9]([a-z0-9-]*[a-z0-9])?$",
          "maxLength": 64
        },
        "path": {
          "type": "string",
          "description": "SKILL.md path relative to the repository root."
        },
        "description": {
          "type": "string",
          "description": "Original description from skill frontmatter, including trigger keywords.",
          "maxLength": 1024
        },
        "compatibility": {
          "type": "array",
          "description": "Environment or skill dependencies as free-text entries. Omit when absent.",
          "items": { "type": "string" }
        },
        "allowed_tools": {
          "type": "string",
          "description": "Original Claude Code allowed-tools frontmatter field. Omit when absent."
        },
        "family": {
          "type": "string",
          "description": "Skill family, such as coding-convention, domain, or system. Inferred from directory structure and the system skill list.",
          "enum": ["coding-convention", "domain", "system"]
        },
        "governance_class": {
          "type": "string",
          "description": "Governance involvement taxonomy for the skill. This does not replace family; it expresses how much domain, verification, and lifecycle skills participate in governance judgment as a separate axis.",
          "enum": [
            "boundary-gate",
            "coding-process",
            "completion-gate",
            "core-gate",
            "domain-orchestration",
            "governance-subskill",
            "intent-state-producer",
            "non-governance-domain",
            "verification-subskill"
          ]
        },
        "meta": {
          "type": "boolean",
          "description": "Whether this is a meta entrypoint. When true, the skill dispatches other skills. Currently applies only to using-coding-convention.",
          "default": false
        },
        "calls_relation": {
          "type": "array",
          "description": "Static handoff/flow relationships declared by SKILL.md frontmatter calls. calls means possible agent-side flow or handoff, not runtime dependency, consumer-read relationship, or dynamic loop.",
          "items": {
            "type": "object",
            "required": ["target", "type"],
            "additionalProperties": false,
            "properties": {
              "target": {
                "type": "string",
                "description": "Called skill name. For type=meta, target may be '*' to mean all catalog skills. For non-meta internal calls, target must refer to another catalog entry; use external_target for skills outside the catalog."
              },
              "external_target": {
                "type": "string",
                "description": "Dependency outside this catalog, such as Anthropic-provided docx or pdf skills. Use either target or external_target, not both."
              },
              "type": {
                "type": "string",
                "description": "Call relationship type. type=meta may use target='*' as a catalog wildcard.",
                "enum": ["hard", "soft", "union", "meta", "external-hard", "external-union"]
              },
              "union_group": {
                "type": "string",
                "description": "Used only when type=union. Entries in the same union_group form an OR relationship selected by the user."
              },
              "source_line": {
                "type": "integer",
                "description": "Body citation location as a SKILL.md line number. Forensic field for verifiability.",
                "minimum": 1
              },
              "note": {
                "type": "string",
                "description": "Relationship note, body citation, or current policy document reference.",
                "maxLength": 200
              }
            }
          }
        }
      }
    }
  }
}
