{
  "version": "1.3.0",
  "generated_at": "2026-11-01T05:38:55Z",
  "source_root": ".",
  "install_roots": [
    "adversarial-verification",
    "agent-security-scan",
    "boundary-contract",
    "coding-convention",
    "compact-handoff",
    "merge-companion",
    "necessity-gate",
    "session-intent-analyzer",
    "skill-evolution",
    "task-router"
  ],
  "skills": [
    {
      "name": "adversarial-verification",
      "path": "adversarial-verification/SKILL.md",
      "description": "Assigns independent delegates to try to refute a claim and its evidence and returns a verdict with the part that survives, when the user or another skill calls for an adversarial review or fact-check of a numeric, legal, novelty or prior-art claim.",
      "family": "domain",
      "governance_class": "verification-subskill",
      "compatibility": [
        "Python 3.11+ standard library"
      ]
    },
    {
      "name": "agent-security-scan",
      "path": "agent-security-scan/SKILL.md",
      "description": "Scans the assistant's settings, hooks, skills, Model Context Protocol config and credential files for exposed secrets, remote fetches and side-effecting shell commands, after any of them changes or governance rules from another project are adopted, or when the user asks to check them.",
      "family": "domain",
      "governance_class": "governance-subskill",
      "compatibility": [
        "Python 3.11+ standard library"
      ]
    },
    {
      "name": "boundary-contract",
      "path": "boundary-contract/SKILL.md",
      "description": "Writes a boundary contract listing the work's objective, allowed and prohibited paths and actions, done conditions, phase and stop conditions, when task-router requires one.",
      "family": "system",
      "governance_class": "boundary-gate",
      "compatibility": [
        "Python 3.11+ standard library"
      ]
    },
    {
      "name": "brainstorming",
      "path": "coding-convention/brainstorming/SKILL.md",
      "description": "Resolves open design decisions, including expected behavior, with the user and writes the accepted design before implementation.",
      "family": "coding-convention",
      "governance_class": "coding-process",
      "compatibility": [
        "Python 3.11+ standard library"
      ],
      "calls_relation": [
        {
          "type": "hard",
          "target": "writing-plans"
        }
      ]
    },
    {
      "name": "compact-handoff",
      "path": "compact-handoff/SKILL.md",
      "description": "Writes a handoff of the task's objective, scope, evidence and next action when a long conversation, compaction or handover to another session or agent could lose them, and resumes the task from it afterwards.",
      "family": "domain",
      "governance_class": "governance-subskill",
      "compatibility": [
        "Python 3.11+ standard library",
        "Ghost-ALICE _shared/text_lines.py, installed beside the skill"
      ]
    },
    {
      "name": "dispatching-parallel-agents",
      "path": "coding-convention/dispatching-parallel-agents/SKILL.md",
      "description": "Assigns two or more tasks to delegates that run in parallel and combines their outputs, when no task edits a file another task reads or edits, no two share mutable state or an exclusive resource, and none needs another's output.",
      "family": "coding-convention",
      "governance_class": "coding-process",
      "compatibility": [
        "Python 3.11+ standard library"
      ]
    },
    {
      "name": "executing-plans",
      "path": "coding-convention/executing-plans/SKILL.md",
      "description": "Executes an accepted plan with the response model doing every task itself, when inline execution is chosen.",
      "family": "coding-convention",
      "governance_class": "coding-process",
      "compatibility": [
        "Python 3.11+ standard library"
      ],
      "calls_relation": [
        {
          "type": "hard",
          "target": "finishing-a-development-branch"
        },
        {
          "type": "hard",
          "target": "using-git-worktrees"
        }
      ]
    },
    {
      "name": "finishing-a-development-branch",
      "path": "coding-convention/finishing-a-development-branch/SKILL.md",
      "description": "For a branch ready to integrate, runs its locally runnable CI jobs before any push or merge and carries out the user's choice, asking if undecided: merge locally, open or merge a pull request, keep, or delete the branch.",
      "family": "coding-convention",
      "governance_class": "completion-gate",
      "compatibility": [
        "Python 3.11+ standard library"
      ],
      "calls_relation": [
        {
          "type": "soft",
          "target": "using-git-worktrees"
        },
        {
          "type": "soft",
          "target": "requesting-code-review"
        }
      ]
    },
    {
      "name": "merge-companion",
      "path": "merge-companion/SKILL.md",
      "description": "Reviews the user's backed-up edits to installed skills and merges each into the new skill version, discards or defers it as the user chooses, before a task changes or reinstalls an installed skill, or when the user asks for that review.",
      "family": "domain",
      "governance_class": "governance-subskill",
      "compatibility": [
        "Python 3.11+ standard library"
      ]
    },
    {
      "name": "necessity-gate",
      "path": "necessity-gate/SKILL.md",
      "description": "Approves, rescopes or rejects new work (a task, follow-up, skill, file, tool, audit or verification cycle, or skill edit) when the response model proposes it or the user asks whether to do it.",
      "family": "domain",
      "governance_class": "governance-subskill",
      "compatibility": [
        "Python 3.11+ standard library"
      ]
    },
    {
      "name": "receiving-code-review",
      "path": "coding-convention/receiving-code-review/SKILL.md",
      "description": "When code review findings arrive, judges each against the requirements, code and tests before changing code, then fixes valid ones, rejects incorrect ones with evidence and reports the rest as unresolved.",
      "family": "coding-convention",
      "governance_class": "verification-subskill",
      "compatibility": [
        "Python 3.11+ standard library"
      ]
    },
    {
      "name": "requesting-code-review",
      "path": "coding-convention/requesting-code-review/SKILL.md",
      "description": "Has a delegate review the code after a major feature is built or before a merge into main, and checks that a pull request's reviews finished and CI passed on its latest commit before merging it.",
      "family": "coding-convention",
      "governance_class": "verification-subskill",
      "compatibility": [
        "Python 3.11+ standard library"
      ]
    },
    {
      "name": "session-intent-analyzer",
      "path": "session-intent-analyzer/SKILL.md",
      "description": "Records the response model's new or changed interpretation of a request before the first tool call of work, and reads the stored interpretation when it can change the objective, constraints, work choice or whether earlier work continues.",
      "family": "system",
      "governance_class": "intent-state-producer",
      "compatibility": [
        "Python 3.11+ standard library",
        "hook-capable environments plus hookless/manual fallback"
      ],
      "calls_relation": [
        {
          "type": "soft",
          "target": "skill-evolution"
        }
      ]
    },
    {
      "name": "skill-evolution",
      "path": "skill-evolution/SKILL.md",
      "description": "Recommends skill changes from recorded tool-call patterns and corrections of the response model's behavior, when the user asks for such recommendations or their pending backlog, or authorizes that analysis.",
      "family": "domain",
      "governance_class": "governance-subskill",
      "compatibility": [
        "Python 3.11+ standard library"
      ]
    },
    {
      "name": "subagent-driven-development",
      "path": "coding-convention/subagent-driven-development/SKILL.md",
      "description": "Executes an accepted plan in this session by giving each task, one at a time, to a new delegate and reviewing the result, when the user chose delegate execution and each task is self-contained.",
      "family": "coding-convention",
      "governance_class": "coding-process",
      "compatibility": [
        "Python 3.11+ standard library"
      ]
    },
    {
      "name": "systematic-debugging",
      "path": "coding-convention/systematic-debugging/SKILL.md",
      "description": "Before a fix is proposed for a failure with an unclear cause, tests hypotheses, fixes the supported cause and counts failed fix attempts, reassessing the hypothesis after five.",
      "family": "coding-convention",
      "governance_class": "verification-subskill",
      "compatibility": [
        "Python 3.11+ standard library"
      ]
    },
    {
      "name": "task-router",
      "path": "task-router/SKILL.md",
      "description": "Selects the work, skills, done conditions and boundary contract for a request that needs or may need a tool to change, run, analyze or verify something, or to read a remote source.",
      "family": "system",
      "governance_class": "core-gate",
      "compatibility": [
        "Python 3.11+ standard library"
      ],
      "calls_relation": [
        {
          "type": "meta",
          "target": "*"
        }
      ]
    },
    {
      "name": "test-driven-development",
      "path": "coding-convention/test-driven-development/SKILL.md",
      "description": "Writes a failing test before the code that makes it pass, for a feature or bug fix whose expected behavior is known and testable through the production code.",
      "family": "coding-convention",
      "governance_class": "verification-subskill",
      "compatibility": [
        "Python 3.11+ standard library"
      ]
    },
    {